{
  "$schema": "migrations.schema.json",
  "version": 1,
  "hf_repo": "silveroxides/ComfyUI-UtilsCollection-Models",
  "folder_category": "controlnet_preprocessors",
  "folder_relative": "controlnet/preprocessors",
  "models": {
    "openpose_body": {
      "module": "openpose", "architecture": "BodyPoseModel", "source_format": "state_dict",
      "source_repo": "lllyasviel/Annotators", "source_file": "body_pose_model.pth",
      "filename": "openpose_body.safetensors", "hf_path": "preprocessors/openpose/openpose_body.safetensors",
      "mapping": "strip_model_prefix", "input": "NCHW BGR /256-0.5", "output": "PAF N38HW; heatmaps N19HW"
    },
    "openpose_hand": {
      "module": "openpose", "architecture": "HandPoseModel", "source_format": "state_dict",
      "source_repo": "lllyasviel/Annotators", "source_file": "hand_pose_model.pth",
      "filename": "openpose_hand.safetensors", "hf_path": "preprocessors/openpose/openpose_hand.safetensors",
      "mapping": "strip_model_prefix", "input": "NCHW BGR /256-0.5; 184/368/552/736 square", "output": "heatmaps N22HW"
    },
    "openpose_face": {
      "module": "openpose", "architecture": "FacePoseModel", "source_format": "state_dict",
      "source_repo": "lllyasviel/Annotators", "source_file": "facenet.pth",
      "filename": "openpose_face.safetensors", "hf_path": "preprocessors/openpose/openpose_face.safetensors",
      "mapping": "module_maps", "input": "NCHW BGR /256-0.5; 384 square", "output": "heatmaps N71HW"
    },
    "dwpose_detector": {
      "module": "yolox", "architecture": "YOLOXDetector", "source_format": "torchscript",
      "source_repo": "hr16/yolox-onnx", "source_file": "yolox_l.torchscript.pt",
      "filename": "dwpose_yolox_l.safetensors", "hf_path": "detectors/dwpose_yolox_l.safetensors",
      "mapping": "module_maps", "input": "NCHW 0..255; 640 square", "output": "raw YOLOX N8400x85"
    },
    "dwpose_pose": {
      "module": "rtmpose", "architecture": "RTMPoseEstimator", "source_format": "torchscript",
      "source_repo": "hr16/DWPose-TorchScript-BatchSize5", "source_file": "dw-ll_ucoco_384_bs5.torchscript.pt",
      "filename": "dwpose_ucoco_384.safetensors", "hf_path": "preprocessors/dwpose/dwpose_ucoco_384.safetensors",
      "mapping": "module_maps", "input": "NCHW normalized BGR; 384x288", "output": "SimCC N133x576; N133x768"
    },
    "animalpose": {
      "module": "rtmpose", "architecture": "AP10KPoseEstimator", "source_format": "torchscript",
      "source_repo": "hr16/DWPose-TorchScript-BatchSize5", "source_file": "rtmpose-m_ap10k_256_bs5.torchscript.pt",
      "filename": "animalpose_ap10k_256.safetensors", "hf_path": "preprocessors/animalpose/animalpose_ap10k_256.safetensors",
      "mapping": "module_maps", "map_prefix": "AP10K_", "input": "NCHW normalized RGB; 256 square", "output": "SimCC N17x512; N17x512"
    },
    "densepose_r50": {
      "module": "densepose", "architecture": "DensePoseModel", "source_format": "torchscript",
      "source_repo": "LayerNorm/DensePose-TorchScript-with-hint-image", "source_file": "densepose_r50_fpn_dl.torchscript",
      "filename": "densepose_r50_fpn.safetensors", "hf_path": "preprocessors/densepose/densepose_r50_fpn.safetensors",
      "mapping": "module_maps", "input": "NCHW RGB 0..255; model normalizes and pads to stride32",
      "output": "per-frame (boxes, coarse, fine, u, v), tensors remain on execution device"
    },
    "yolo_segm_face_v8m": {
      "module": "yolo", "architecture": "YOLOv8mSeg", "source_format": "yolo_checkpoint",
      "source_repo": "Bingsu/adetailer", "source_file": "face_yolov8m-seg_60.pt",
      "filename": "face_yolov8m-seg_60.safetensors", "hf_path": "yolo/segm/face_yolov8m-seg_60.safetensors",
      "folder_category": "yolo_segm", "folder_relative": "yolo/segm",
      "mapping": "module_maps", "task": "segm", "imgsz": 640, "labels": ["face"],
      "input": "NCHW RGB 0..1 letterboxed to stride32 (640)", "output": "(predictions B37xA, protos B32xH/4xW/4)"
    },
    "yolo_segm_person_v8m": {
      "module": "yolo", "architecture": "YOLOv8mSeg", "source_format": "yolo_checkpoint",
      "source_repo": "Bingsu/adetailer", "source_file": "person_yolov8m-seg.pt",
      "filename": "person_yolov8m-seg.safetensors", "hf_path": "yolo/segm/person_yolov8m-seg.safetensors",
      "folder_category": "yolo_segm", "folder_relative": "yolo/segm",
      "mapping": "module_maps", "task": "segm", "imgsz": 640, "labels": ["person"],
      "input": "NCHW RGB 0..1 letterboxed to stride32 (640)", "output": "(predictions B37xA, protos B32xH/4xW/4)"
    },
    "yolo_segm_skin_v8m": {
      "module": "yolo", "architecture": "YOLOv8mSeg", "source_format": "yolo_checkpoint",
      "source_repo": "Bingsu/adetailer", "source_file": "skin_yolov8m-seg_400.pt",
      "filename": "skin_yolov8m-seg_400.safetensors", "hf_path": "yolo/segm/skin_yolov8m-seg_400.safetensors",
      "folder_category": "yolo_segm", "folder_relative": "yolo/segm",
      "mapping": "module_maps", "task": "segm", "imgsz": 640, "labels": ["skin"],
      "input": "NCHW RGB 0..1 letterboxed to stride32 (640)", "output": "(predictions B37xA, protos B32xH/4xW/4)"
    },
    "yolo_segm_hair_v8n": {
      "module": "yolo", "architecture": "YOLOv8nSeg", "source_format": "yolo_checkpoint",
      "source_repo": "Bingsu/adetailer", "source_file": "hair_yolov8n-seg_60.pt",
      "filename": "hair_yolov8n-seg_60.safetensors", "hf_path": "yolo/segm/hair_yolov8n-seg_60.safetensors",
      "folder_category": "yolo_segm", "folder_relative": "yolo/segm",
      "mapping": "module_maps", "task": "segm", "imgsz": 640, "labels": ["hair"],
      "input": "NCHW RGB 0..1 letterboxed to stride32 (640)", "output": "(predictions B37xA, protos B32xH/4xW/4)"
    },
    "yolo_bbox_face_v8m": {
      "module": "yolo", "architecture": "YOLOv8mDetect", "source_format": "yolo_checkpoint",
      "source_repo": "Bingsu/adetailer", "source_file": "face_yolov8m.pt",
      "filename": "face_yolov8m.safetensors", "hf_path": "yolo/bbox/face_yolov8m.safetensors",
      "folder_category": "yolo_bbox", "folder_relative": "yolo/bbox",
      "mapping": "module_maps", "task": "bbox", "imgsz": 640, "labels": ["face"],
      "input": "NCHW RGB 0..1 letterboxed to stride32 (640)", "output": "predictions B5xA"
    },
    "yolo_bbox_hand_v8s": {
      "module": "yolo", "architecture": "YOLOv8sDetect", "source_format": "yolo_checkpoint",
      "source_repo": "Bingsu/adetailer", "source_file": "hand_yolov8s.pt",
      "filename": "hand_yolov8s.safetensors", "hf_path": "yolo/bbox/hand_yolov8s.safetensors",
      "folder_category": "yolo_bbox", "folder_relative": "yolo/bbox",
      "mapping": "module_maps", "task": "bbox", "imgsz": 640, "labels": ["hand"],
      "input": "NCHW RGB 0..1 letterboxed to stride32 (640)", "output": "predictions B5xA"
    },
    "yolo_bbox_watermark_v11x": {
      "module": "yolo", "architecture": "YOLO11xDetect", "source_format": "yolo_checkpoint",
      "source_repo": "yolo11/watermark", "source_file": "yolo11x-train28-best.pt",
      "filename": "yolo11x-train28-best.safetensors", "hf_path": "yolo/bbox/yolo11x-train28-best.safetensors",
      "folder_category": "yolo_bbox", "folder_relative": "yolo/bbox",
      "mapping": "module_maps", "task": "bbox", "imgsz": 1024, "labels": ["watermark"],
      "input": "NCHW RGB 0..1 letterboxed to stride32 (1024)", "output": "predictions B5xA"
    }
  }
}
